question,answer
"What is the current status of Asian Highway 1 (AH1)?","The highway officially reopened on April 2, 2026. While traffic has resumed, it is currently limited to private cars, motorcycles, and small passenger vans. On the first day of reopening, approximately 555 vehicles were recorded traversing the route."
"Are cargo trucks allowed to use the highway yet?","No. Large freight trucks, 12-wheelers, and trailers remain restricted from using the AH1 stretch between Hpa-an and Myawaddy as of early April. Logistics business owners report that dozens of truckloads of goods remain stuck in warehouses waiting for further clearance."
"What is the situation with the Thai-Myanmar Friendship Bridges?","Friendship Bridge No. 1: This bridge, which links the downtown areas of Myawaddy and Mae Sot, has been open for small vehicles and vaccinated travelers since early 2023. Friendship Bridge No. 2: This bridge is specifically designed for heavy cargo and border trade. Despite the highway reopening, Bridge No. 2 remains closed as of April 2026 because the nearby Myawaddy Trade Zone infrastructure was severely damaged and looted during previous fighting."
"Is the route safe for travel?","Security remains a major concern. While the junta has established joint checkpoints with the Border Guard Force (BGF) and conducted religious blessing ceremonies to reassure the public, residents report that fighting continues in nearby areas like Kawkareik and Kyondoe. Resistance groups claim the junta does not have ""full control"" of the entire corridor, and many locals are waiting to see if the safety of the route can be sustained before traveling."
"Why did the junta reopen the road now?","The move is largely seen as an effort to revive border trade, which was worth over $1 billion annually before the conflict. There is also political pressure to show stability as a new administration is expected to take office in Naypyidaw. Additionally, Thailand has been actively engaging with both the junta and ethnic groups to restore trade flows and curb scam-center networks along the border."
"Is it true that the Asian Highway (Myawaddy-Kawkareik) has reopened?","While sections have technically reopened, access is currently limited to private vehicles, with commercial trade still restricted."
"Is fighting still occurring in the vicinity of Kawkareik and Kyondoe?","Yes, intermittent armed clashes continue to break out sporadically throughout those specific areas."
"What is the current status of the Second Friendship Bridge?","Bridge 2 remains closed indefinitely, with no confirmed official date for its reopening at this time."
"Will foreigners be allowed across as soon as the bridge reopens?","Even upon reopening, trade will be the priority; there is little immediate hope for foreign tourists being granted crossing privileges."
"Is it possible to visit Myawaddy on a one-day border pass?","A reopening for foreign tourists, even for short-day visits, is not expected in the foreseeable future."
"How long has the Asian Highway been affected by closures?","This strategic route has faced significant disruptions and closures for nearly two years since late 2023 due to heavy fighting."
"Can commuters use the old mountain detour roads instead?","Authorities have blocked these detours, and since they are controlled by armed groups, they are not viable for safe travel."
"What is the current state of cross-border trade?","Trade is largely paralyzed due to the road blocks, leaving many businesses and traders in a difficult position."
"Are there new regulations for Myanmar vehicles entering the Thai side?","Thai officials have tightened restrictions, turning back Myanmar vehicles that lack clear and matching ownership documentation."
"Are other land borders open for foreign travelers to enter Myanmar?","Land border entry is currently extremely restricted for foreigners, making air travel the only reliable method for entry."
"How reliable is this information regarding the current situation?","This data is based on recent reports from reputable sources like The Irrawaddy and various Thai news agencies."
"What is the atmosphere like on the Mae Sot side of the border?","Thai forces have deployed extra security to the border to monitor the situation and prevent any spillover from the conflict."
"What should people planning to travel do right now?","Since the border situation remains volatile, travelers must stay updated on the latest news before making any movement."
"Who currently controls the stretch between Kawkareik and Myawaddy?","Area control remains contested, with ongoing intense combat between junta troops and Karen resistance forces."
"Why are there such long vehicle queues at filling stations?","People are buying and storing as much as possible due to growing concerns that shortages will worsen in the future."
"What is the impact of these fuel queues on city traffic?","The long lines at gas stations are spilling onto the streets, causing major traffic jams."
"How active is the fuel black market right now?","The black market is in full swing, operating openly even during broad daylight."
"Why are some taxi drivers reselling fuel instead of driving?","Reselling fuel on the black market provides a higher income than actually operating a taxi service."
"What is the latest restriction imposed specifically on taxis?","Taxis are now required to prove they have actually used their fuel by showing their kilometer records."
"Is the kilometer record requirement practical for drivers?","This regulation is considered ridiculous and entirely impractical for daily operations."
"What challenges are EV owners currently facing?","Just like fuel-powered cars, EVs are now forced to queue for long hours at charging stations."
"Can EV owners simply recharge their vehicles at home?","Most owners lack home-charging facilities, making them entirely dependent on public charging stations."
"How do power outages affect the operation of EV charging stations?","Due to persistent electricity shortages, some stations are now relying on solar power to function."
"How is the current daily life of Myanmar people being described?","People in Myanmar are effectively undergoing ""great training"" in the art of queuing for everything."
"How much time is typically spent waiting in line at filling stations?","It can take several hours or even a near-entire day of waiting just to secure a small amount of fuel."
"Does the fuel shortage affect the overall cost of goods?","Rising transportation costs are directly causing the prices of basic commodities to increase."
"What is the situation like for EV taxis specifically?","EV taxis are spending more time in charging queues than actually picking up passengers."
"Is solar-powered charging efficient enough for the current demand?","Solar charging is slower than grid power, leading to longer wait times and even bigger queues."
"Are the government's restrictions effectively solving the crisis?","The ""panic buying"" is fueled by the fear that fuel will become completely unavailable in the near future."
"What is driving this aggressive panic buying among the public?","The ""panic buying"" is fueled by the fear that fuel will become completely unavailable in the near future."
"How much higher are black market prices compared to official rates?","Prices are double or triple the official rate, yet people in emergencies are forced to pay them."
"What is the general sentiment among drivers regarding this crisis?","Drivers are deeply frustrated as their days are consumed by the struggle of constant queuing."
"Does the future of EVs still look promising in this environment?","Due to power instability, EVs are proving to be less convenient than originally anticipated."
"When is this crisis expected to be resolved?","Currently, there is no clear timeline for resolution, and the situation appears poised to worsen."
"How was the overall travel experience in Yangon during April 2026?","The visitor had a wonderful time and genuinely loved the atmosphere of the city."
"Which airline and route did the traveler use to reach Myanmar?","They flew with Thai Airways directly from Bangkok to Yangon."
"Where did the traveler choose to stay during their visit?","They stayed at the ParkRoyal Hotel, which offered a comfortable stay despite its dated interior."
"What facilities were available at the hotel mentioned?","The hotel featured four different restaurants for guests to choose from."
"What was the highlight of the city tour?","The Shwedagon Pagoda was described as a phenomenal and must-see landmark."
"Was the visa application process difficult for this trip?","No, the traveler successfully obtained their visa online without any complications."
"Did the visitor encounter any financial issues during their stay?","Credit cards failed to work in some establishments, which was the only notable problem."
"How did the traveler manage their payments when cards failed?","They were well-prepared with plenty of US Dollar cash to cover their expenses."
"What was the traveler's impression of the local people?","They found the people of Myanmar to be incredibly friendly and lovely."
"Does the visitor have any future plans regarding Myanmar?","Yes, they expressed a strong desire to return and explore more of the country soon."
"How long was the duration of this specific trip?","The visit lasted for a couple of days during the month of April."
"Was the ParkRoyal hotel considered a good choice for accommodation?","Although it felt a bit old-fashioned, the visitor found it very comfortable for their stay."
"Is the online visa system currently reliable for tourists?","Based on this experience, the e-visa system is functioning smoothly for international arrivals."
"Is it essential to carry cash when visiting Yangon right now?","Yes, having physical USD is highly recommended since card acceptance can be inconsistent."
"Would the traveler recommend a city tour to others?","Absolutely, especially since it includes iconic sites like the Shwedagon Pagoda."
"When does the traveler intend to visit Myanmar?","The plan is to visit in early December 2026, following a stay in Bangkok."
"What kind of travel arrangement is the person looking for?","They are seeking a 7-day package tour rather than traveling independently."
"What was the main issue with the online travel agencies contacted so far?","Most of the agencies advertised online failed to respond to the traveler's inquiries."
"What kind of tour was offered by the one agency that did reply?","They offered a solo tour that required a grueling 32 hours of inter-city bus travel."
"Does the traveler prefer traveling alone or with others?","The traveler explicitly stated a preference for being part of a small group tour."
"What global event is believed to be causing the current fuel crisis in the region?","The traveler mentioned an international conflict involving the US, Israel, and Iran as the cause."
"How has this global situation impacted Myanmar specifically?","It has resulted in extreme fuel shortages across the country and other Southeast Asian nations."
"Why is the traveler hesitant about ""independent travel"" in Myanmar?","They find Myanmar fascinating but don't feel confident enough to navigate the logistics on their own."
"What is the traveler's primary request in their message?","They are looking for recommendations for reputable travel agencies that operate during ""normal"" times."
"Is inter-city bus travel a preferred option for this tourist?","No, the idea of spending 32 hours on a bus for a solo tour was not appealing to them."
"Are domestic flights currently a reliable option in Myanmar?","As of early 2026, domestic flights face major disruptions due to severe aviation fuel shortages."
"Which specific destinations do small group tours usually cover?","Most reputable tours focus on stable areas like Yangon, Bagan, Mandalay, and Inle Lake."
"What should a traveler look for to confirm an agency is still active?","It is best to check for websites that explicitly list updated ""2026 Departure Dates."""
"Are there any ethical travel agencies recommended for Myanmar?","Yes, ""Responsible Travel"" is often cited for those looking for ethical and small-group cultural trips."
"How many people typically make up a ""small group"" in these tours?","Depending on the agency, a small group can range from 2 to 12 participants."
"What is the expected timeline for the fuel situation to stabilize?","Market analysts suggest it could take 4 to 6 months for energy supplies to normalize."
"Is Myanmar currently considered a ""fascinating"" destination by the user?","Yes, the user is very interested in the country's culture despite the current challenges."
"Why might some agencies be slow to respond to emails right now?","The ongoing fuel crisis and logistical chaos have likely made it difficult for them to confirm itineraries."
"What is the benefit of using an ""escorted"" group tour?","It provides full-time guidance and handles all logistics, which is ideal for those wary of solo travel."
"Does the traveler plan to arrive in Myanmar directly from Europe?","No, their plan involves traveling to Myanmar after being in Bangkok, Thailand."
"Are the hill tribe vendors still operating at their usual markets?","Many have moved to temporary stalls or smaller galleries while the main market structures are being repaired."
"Where is the best place to find hill tribe artifacts in Yangon post-earthquake?","Bogyoke Market's reinforced ground-floor shops and specialized hotel galleries are currently the most reliable spots."
"Can I buy artifacts uncovered during the earthquake?","No, purchasing items newly unearthed by the earthquake is risky and often illegal, as they are considered protected national heritage."
"Is the road to the hill tribe regions in central Myanmar safe for travel?","Many roads remain under repair; it is better to fly to major hubs like Mandalay and then use local transport."
"How should I pay for artifacts in these temporary markets?","Cash (USD or Kyat) is essential, as many digital payment systems are still offline in damaged areas."
"Where should I stay in Yangon (Rangoon)?","We recommend staying at one of the most popular hotels in Yangon (Rangoon), which include: Melia Yangon,Wyndham Grand Yangon Hotel,LOTTE HOTEL YANGON,Inya Lake Hotel Yangon,Hotel G Yangon."
"What are the best places to eat in Yangon (Rangoon)?","Some of the most popular restaurants in Yangon (Rangoon) include: The Market,Seeds Restaurant & Lounge,Cho Japanese Dining & Bar,Babett Eatery & Bar,Le Cellier,wine Bar & Restaurant."
"What is Yangon (Rangoon) known for?","Yangon (Rangoon) is known for some of its popular attractions, which include: Shwedagon Pagoda,Myanmar Plaza,Junction City,Junction Square,National Museum."
"What is there to do in Yangon (Rangoon)?","We recommend checking out these popular tours when looking for something to do in Yangon (Rangoon): Yangon Full Day City Tour,Walking Tour in Downtown Yangon,Golden Rock day trip from Yangon,Yangon morning food tour with train ride,Private Bago Full-Day Tour from Yangon."
"When is the cheapest time to visit Yangon (Rangoon)?","If you're a more budget-conscious traveler, then you may want to consider traveling to Yangon (Rangoon) between March and May, when hotel prices are generally the lowest. Peak hotel prices generally start between December and February."
"Is Yangon considered dangerous according to UK government advice?","While the UK FCDO does not currently advise against traveling to Yangon, many other Western nations have designated it as a high-risk zone."
"What is the official stance of the U.S. government on traveling to Myanmar?","The United States maintains a ""Level 4: Do Not Travel"" advisory for the entire country, which is their highest level of security warning."
"Are explosions a common occurrence within Yangon city limits?","Reports suggest an average of over 20 explosions per month in the greater Yangon area, typically targeting administrative or security-related sites."
"Should I expect security screenings while moving around the city?","Yes, you may encounter frequent checkpoints where security forces inspect passports and visas; it is essential to carry your original documents at all times."
"Is there a genuine risk of foreign nationals being detained without cause?","Several embassies have warned of ""wrongful detention,"" where individuals may be arrested on trumped-up charges or for political reasons."
"Can my past social media activity lead to an arrest upon arrival?","Yes, authorities have been known to monitor online criticism of the government; even posts made before entering the country can be used as grounds for detention."
"If detained, can my embassy provide immediate legal or diplomatic assistance?","Local authorities may deny or delay consular access for a significant period, making it very difficult for your embassy to intervene quickly."
